{
  "format": "pixel-wave-terrain-profile",
  "schemaVersion": 1,
  "id": "stage1-near-v1",
  "name": "산호 초입 전경 지형",
  "binding": {
    "backgroundPresetId": "stage1",
    "layer": "near",
    "assetId": "background.stage1.near",
    "assetPath": "assets/backgrounds/stage1-near-strip.png",
    "assetSha256": "eca0508362c00b25051bf215bb0ea17d2a1d5849c530f674acd6a15494642c2b",
    "structuralMaskPath": "assets/backgrounds/stage1-near-terrain-mask.png",
    "structuralMaskSha256": "5060e5f9023fa3ec498c0b690fb53ad52ca7a0138e4b517aae95eab3ad8e8a9e",
    "width": 1440,
    "height": 128
  },
  "coordinateSpace": {
    "unit": "native-pixel",
    "origin": "image-top-left",
    "xAxis": "right",
    "yAxis": "down",
    "wrapX": true
  },
  "surfaces": {
    "floor": {
      "samples": [
        100,
        100,
        100,
        100,
        100,
        100,
        100,
        100,
        99,
        99,
        99,
        99,
        99,
        99,
        99,
        99,
        95,
        94,
        94,
        94,
        95,
        97,
        97,
        97,
        101,
        101,
        101,
        103,
        104,
        107,
        107,
        108,
        108,
        106,
        106,
        106,
        105,
        106,
        102,
        101,
        100,
        100,
        100,
        100,
        101,
        102,
        107,
        106,
        106,
        105,
        105,
        105,
        105,
        106,
        107,
        108,
        108,
        108,
        107,
        107,
        107,
        106,
        106,
        105,
        104,
        104,
        104,
        103,
        102,
        102,
        103,
        105,
        100,
        99,
        99,
        99,
        94,
        94,
        95,
        93,
        92,
        92,
        93,
        95,
        94,
        94,
        95,
        99,
        98,
        99,
        100,
        98,
        98,
        97,
        97,
        97,
        97,
        98,
        99,
        106,
        106,
        106,
        106,
        107,
        107,
        107,
        108,
        108,
        109,
        109,
        110,
        110,
        109,
        108,
        107,
        106,
        105,
        105,
        105,
        105,
        106,
        102,
        101,
        100,
        100,
        100,
        100,
        101,
        102,
        108,
        107,
        107,
        107,
        107,
        107,
        107,
        107,
        107,
        107,
        108,
        105,
        104,
        105,
        103,
        102,
        102,
        103,
        104,
        103,
        102,
        102,
        102,
        103,
        104,
        108,
        107,
        106,
        106,
        106,
        106,
        105,
        102,
        101,
        101,
        102,
        99,
        98,
        98,
        99,
        102,
        101,
        102,
        104,
        105,
        107,
        106,
        104,
        101,
        100,
        100,
        101,
        95,
        95,
        94,
        95,
        93,
        92,
        92,
        93,
        96,
        94,
        94,
        95,
        101,
        100,
        100,
        101,
        102,
        109,
        108,
        108,
        107,
        107,
        106,
        106,
        105,
        105,
        105,
        105,
        106,
        106,
        107,
        107,
        104,
        103,
        103,
        104,
        99,
        98,
        99,
        97,
        96,
        96,
        97,
        99,
        98,
        98,
        99,
        103,
        103,
        104,
        106,
        104,
        104,
        104,
        104,
        105,
        106,
        107,
        110,
        110,
        109,
        109,
        109,
        109,
        109,
        110,
        111,
        111,
        110,
        109,
        109,
        109,
        108,
        104,
        102,
        100,
        100,
        101,
        95,
        95,
        95,
        95,
        93,
        92,
        92,
        93,
        95,
        94,
        95,
        95,
        100,
        99,
        100,
        102,
        104,
        103,
        103,
        104,
        99,
        98,
        99,
        97,
        96,
        96,
        97,
        99,
        98,
        98,
        99,
        103,
        103,
        103,
        103,
        103,
        103,
        103,
        103,
        102,
        101,
        101,
        100,
        100,
        99,
        98,
        98,
        98,
        97,
        96,
        96,
        96,
        97,
        97,
        97,
        98,
        88,
        87,
        86,
        85,
        79,
        78,
        77,
        77,
        76,
        73,
        67,
        66,
        66,
        56,
        55,
        54,
        54,
        49,
        45,
        44,
        42,
        41,
        40,
        39,
        39,
        40,
        42,
        41,
        42,
        45,
        44,
        45,
        50,
        52,
        53,
        52,
        51,
        51,
        51,
        52,
        53,
        59,
        59,
        59,
        68,
        83,
        84,
        90,
        92,
        93,
        94,
        95,
        102,
        103,
        102,
        102,
        102,
        102,
        102,
        103,
        104,
        109,
        109,
        110,
        110,
        110,
        111,
        111,
        110,
        109,
        108,
        105,
        104,
        104,
        104,
        102,
        102,
        103,
        104,
        104,
        104,
        105,
        104,
        101,
        101,
        100,
        101,
        96,
        95,
        95,
        96,
        94,
        93,
        93,
        94,
        96,
        95,
        95,
        96,
        101,
        100,
        101,
        102,
        103,
        107,
        107,
        108,
        107,
        108,
        109,
        110,
        110,
        111,
        111,
        111,
        112,
        112,
        111,
        110,
        109,
        109,
        110,
        107,
        106,
        104,
        104,
        104,
        104,
        106,
        107,
        110,
        110,
        109,
        109,
        109,
        108,
        107,
        107,
        108,
        102,
        102,
        102,
        101,
        100,
        99,
        100,
        101,
        103,
        102,
        102,
        102,
        102,
        102,
        101,
        101,
        100,
        99,
        100,
        101,
        101,
        101,
        100,
        100,
        100,
        100,
        100,
        100,
        100,
        100,
        101,
        101,
        101,
        101,
        101,
        101,
        101,
        101,
        102,
        102,
        102,
        102,
        102,
        103,
        101,
        100,
        99,
        100,
        101,
        102,
        102,
        102,
        108,
        107,
        107,
        108,
        109,
        109,
        109,
        110,
        110,
        107,
        106,
        104,
        104,
        104,
        104,
        106,
        107,
        110,
        109,
        109,
        110,
        111,
        112,
        112,
        111,
        111,
        111,
        110,
        110,
        109,
        108,
        107,
        108,
        107,
        107,
        103,
        102,
        101,
        100,
        101,
        96,
        95,
        95,
        96,
        94,
        93,
        93,
        94,
        96,
        95,
        95,
        96,
        101,
        100,
        101,
        101,
        104,
        105,
        104,
        104,
        104,
        103,
        102,
        102,
        104,
        104,
        104,
        105,
        108,
        109,
        110,
        111,
        111,
        110,
        110,
        110,
        109,
        109,
        104,
        103,
        102,
        102,
        102,
        102,
        102,
        103,
        104,
        108,
        108,
        107,
        107,
        107,
        108,
        109,
        110,
        109,
        108,
        102,
        101,
        100,
        99,
        97,
        96,
        96,
        97,
        99,
        98,
        99,
        103,
        104,
        100,
        100,
        100,
        98,
        97,
        97,
        98,
        100,
        99,
        99,
        100,
        104,
        104,
        104,
        106,
        106,
        106,
        106,
        106,
        105,
        104,
        103,
        102,
        101,
        100,
        99,
        99,
        98,
        98,
        98,
        97,
        97,
        97,
        96,
        96,
        96,
        97,
        98,
        98,
        98,
        99,
        100,
        100,
        101,
        101,
        102,
        103,
        103,
        103,
        103,
        103,
        103,
        103,
        103,
        99,
        98,
        98,
        99,
        97,
        96,
        96,
        97,
        99,
        98,
        99,
        104,
        103,
        103,
        104,
        102,
        100,
        99,
        100,
        95,
        95,
        94,
        95,
        93,
        92,
        92,
        93,
        95,
        95,
        95,
        95,
        101,
        100,
        100,
        102,
        104,
        108,
        109,
        109,
        109,
        110,
        111,
        111,
        110,
        109,
        109,
        109,
        109,
        109,
        110,
        110,
        107,
        106,
        105,
        104,
        104,